매거진 명,업로드 날짜,제목,본문,기사 URL
Vogue,2025-02-26,"2025년 봄, 성공적인 스타일링 완성할 블레이저 3","완벽한 핏의 블레이저만큼 시대를 초월해 사랑받는 패션 아이템이 있을까요? 계절과 유행을 넘어 언제 어디서나 찾아볼 수 있는 이유가 있습니다. 격식을 차려야 하는 사무실이든, 가족과의 휴일 나들이든, 친구들과 보내는 주말 저녁이든, 입고 나갔을 때 어색함이 없죠. 물론 블레이저의 장점이 어떤 장소에나 잘 어울린다는 데서 그치진 않습니다. 빈티지한 블레이저와 모던한 라인의 블레이저 모두 자연스럽게 세련된 느낌을 내죠.
2025 봄/여름 런웨이에서 주목할 만한 점은1980년대 스타일의 블레이저를 재해석했다는 것입니다. 블레이저는 이제 더 이상 ‘사무실용 재킷’이 아니죠. 여성의 우아함과 힘을 보여주는 패션 아이템에 더 가까울 겁니다. 기능성과 심미성의 균형을 유지하며 여성 패션의 진화에 핵심 역할을 해왔으니까요. 모든 이너와 팬츠를 돋보이게 하는 건 덤이고요.
누구나 입지만, 아무나 만들 수 없는 블레이저계에 새로운 인물이 등장했습니다. 파워 숄더를 사랑하는에밀리 라타이코프스키입니다. 그녀가 이탈리아 패션 브랜드 마렐라(Marella)와 손잡고 블레이저 트렌드에 새로운 비전을 제시했습니다. 이들은 2025 봄/여름 컬렉션을 통해 블레이저의 클래식한 아름다움을 다시 정의했죠. 우아하고 고급스러운 소재에 현대적인 디테일을 반영한 부분이 눈에 띕니다. 이를 참고해 올봄 훌륭한 스타일링을 완성할 세 가지 블레이저를 골라봤습니다.
평생 단 한 벌의 블레이저만 구입할 수 있다면, 많은 패셔니스타가 가죽 블레이저를 택할 겁니다. 잘 선택한 가죽 블레이저는 평생 우리 옷장에 자리할 수 있는 흔치 않은 아이템이니까요. 시간이 지날수록 세월의 흔적을 간직해 나만의 특별한 블레이저로 길들일 수도 있고요. 올봄엔 그런 인생 블레이저를 만나보는 건 어떨까요? 별다른 장식 없이 심플한 디자인과 허리에 묶은 벨트로 잡아준 깔끔한 라인이 유행을 타지 않는 우아함을 선사할 거예요.

통 넓은 청바지가 하의 트렌드를 주도했다면, 아우터웨어 트렌드는 라운드 실루엣 블레이저가 주도합니다. 우아한 실루엣으로 클래식한 블레이저의 본질을 잃지 않으면서, 넉넉한 핏이 현대적인 느낌을 더하죠. 어떻게 매치할지 모르겠다고요? 중요한 것은 밸런스입니다. 스트레이트 팬츠나 타이트한 스커트와 함께 입으면 개성 있으면서도 조화로운 스타일링이 완성되죠.

데님은 어떤 의상에도 완벽하게 어울리는 소재입니다. 2025년, 데님은 블레이저의 모습으로 우리를 찾아왔습니다. 높은 활동성에 캐주얼한 느낌을 더하죠. 산뜻하면서도 자연스러운 스타일링에는 밝고 빛바랜 컬러의 블레이저가 도움이 될 겁니다. 하얀 블라우스와 플리츠 팬츠로 간편함을 한 스푼 더한 오피스 룩을 연출해도, 데님 쇼츠와 함께 발랄한 무드를 보여줘도 좋겠죠.

위에서 소개한 세 가지 블레이저는 매치하는 의상에 따라 캐주얼하게도, 격식 있게도 보입니다. 언제나 완벽한 스타일링을 유지하고 싶다면 절대 없어서는 안 될 아이템이죠. 올봄, 옷장에 어떤 블레이저를 들이고 싶나요?",https://www.vogue.co.kr/2025/02/26/2025%eb%85%84-%eb%b4%84-%ec%84%b1%ea%b3%b5%ec%a0%81%ec%9d%b8-%ec%8a%a4%ed%83%80%ec%9d%bc%eb%a7%81-%ec%99%84%ec%84%b1%ed%95%a0-%eb%b8%94%eb%a0%88%ec%9d%b4%ec%a0%80-3/
Vogue,2025-02-26,"예쁜 상의의 기준이 될, 2025 민소매 톱 트렌드","배꼽이 훤히 드러나는 탱크 톱이나 화려한 장식의 스트래피 블라우스가 없는 2000년대 패션을 상상해봤습니다. 하품이 나올 정도로 지루하더군요. 올해도 그럴 겁니다. 다가올 봄과 여름의 멋은 우리가‘외출용 상의’라 일컫는 예쁜 상의에 달렸죠. 그중에서도 민소매의 활약이 대단할 겁니다. 그때처럼요.
그 시절 거리에서 민소매 톱을 마주칠 확률은 로우 라이즈 데님이나 스키니 진을 볼 확률과 비슷했습니다. 지천에 널려 있었다는 뜻이지요. 영화 <트랜스포머>의 메간 폭스, <퀸카로 살아남는 법>의 레이첼 맥아담스, 브리트니 스피어스와 패리스 힐튼의 룩은 교과서나 다름없었고요.
2025년 버전은 어떨까요? 2025 봄/여름 런웨이에서 가장 핵심적인 룩 다섯 벌을 골랐습니다. 모두 화려하면서도 간편해 보였지요. 데일리는 물론 파티까지 거뜬한 디자인이었습니다. 스타일링 팁을 얻기도 좋고요. 찬찬히 살펴보세요. 올 봄과 여름, 우리의 외출을 책임질 친구들입니다.
‘외출용 상의’란 정확히 뭘까요? 명쾌하게 정의 내릴 순 없지만 그 시절을 지나온 이라면 누구나 동의할 수 있는 몇 가지 특징이 있습니다. 그중 하나가 바로 ‘장식’이죠. 스팽글, 깃털, 시스루 소재 등 각종 디테일의 상의요! 청바지 한 벌만 입어줘도 근사할 겁니다. 코페르니의 룩처럼요.


미우미우는 수영복을 톱으로 삼았습니다. 현실에서는 스트래피 블라우스로 대체할 수 있겠지요. 이때 유심히 챙겨 봐야 할 디테일은 컷아웃입니다. 쇄골 라인이 훤히 드러나는 스타일도, 옆구리나 가슴 부근을 도려낸 디자인도 좋습니다. 대담할수록 멋이 살죠. 장식 하나 없이 세련된 실루엣을 연출할 수 있는 방법입니다.


보헤미안 시크가 빠질 수 없죠. 2000년대 멋을 상기하기도 좋고요. 얇은 소재, 레이스와 러플로 장식된 로맨틱한 블라우스를 선택해보세요. 스팽글 톱이 부담스러운 이들에게 명쾌한 대안이 될 겁니다.


크롭트 톱은 2000년대 패션을 정의하는 상의 중 하나입니다. 당시에는 미니스커트와 함께 밤 외출을 책임지던 아이템이지요. 2025년엔 좀 더 어른스럽게 즐겨봅시다. 빅토리아 베컴이 보여준 것처럼 드레시한 팬츠를 곁들여 우아함을 노려보는 겁니다.


아티코는 메탈릭 톱과 스포티한 팬츠를 짝지었습니다. 그 시절 크리스티나 아길레라가 떠오르는 실루엣이죠. 깔끔한 탱크 톱 디자인이어도 문제없어요. 번쩍이는 광택만으로 이미 충분하거든요.",https://www.vogue.co.kr/2025/02/26/%ec%98%88%ec%81%9c-%ec%83%81%ec%9d%98%ec%9d%98-%ea%b8%b0%ec%a4%80%ec%9d%b4-%eb%90%a0-2025-%eb%af%bc%ec%86%8c%eb%a7%a4-%ed%86%b1-%ed%8a%b8%eb%a0%8c%eb%93%9c/
Vogue,2025-02-25,"반바지에 흰 운동화, 올봄에 입고 싶은 나긋한 룩!","에어로빅 스타일이 유행할 전망입니다. 다행히도1980년대의 강렬한 피트니스 스타일은 아닙니다.
로스앤젤레스 거리에서 포착된 벨라 하디드를 보세요. 한동안 웨스턴 스타일에 푹 빠져 있던 그녀가 스포티하면서도 청순한 에어로빅 룩이 무엇인지 보여주겠다고 나섰죠. 완벽했고요.
흰색 탱크 톱에 흰색 도트 무늬 사이클 반바지를 매치했는데, 리본 덕분에 귀여움이 더해졌습니다. 여기에 목이 긴 양말을 루스 삭스처럼 신고 흰색 코치 운동화를 매치했죠. 거기에 몸만큼 큰 블랙 생 로랑 Y 백과 동그란 선글라스로 시크함을 가미해 자연스러우면서도 세련된 봄 룩을 완성했습니다.
격식 있는 룩에 잘 어울리는 액세서리를 귀여우면서도 스포티한 스타일에 매치하니 밸런스가 맞으면서 오히려 스타일리시해졌죠.
만약 그녀처럼 엉덩이나 허벅지를 드러내기 꺼려진다면 박시한 흰 티셔츠에 매치해도 비슷한 효과를 얻을 수 있습니다. 어떤 프린트가 들어가느냐에 따라 무드가 조금씩 달라질 테고요. 다가올 봄, 나긋하고 산뜻한 에어로빅 스타일을 즐겨보세요!",https://www.vogue.co.kr/2025/02/25/%eb%b0%98%eb%b0%94%ec%a7%80%ec%97%90-%ed%9d%b0-%ec%9a%b4%eb%8f%99%ed%99%94-%ec%98%ac%eb%b4%84%ec%97%90-%ec%9e%85%ea%b3%a0-%ec%8b%b6%ec%9d%80-%eb%82%98%ea%b8%8b%ed%95%9c-%eb%a3%a9/
Vogue,2025-02-25,"낮을수록 치명적인, 올봄 스커트 스타일링","관능은 옷을 벗었을 때가 아니라 입었을 때 발현됩니다. 중요한 건 노출이 아니라 노출 방식이고요.로우 라이즈 스타일이 극명한 호불호에도 여전히 건재한 이유입니다. 골반, 그러니까 상체와 하체의 경계에 걸친 아슬아슬한 실루엣이 묘한 긴장감을 자아내죠.
로우 라이즈 스커트의 힘을 새삼스레 깨달은 건 샤넬 2025 봄/여름 런웨이에 오른 하늘색 트위드 수트를 마주했을 때였습니다. 단정하다 못해 때로는 올드하다는 평을 받던 트위드 수트가 이토록 장난스럽고 발칙한 매력을 풍길 줄은 몰랐죠. 맥퀸과 아크네 스튜디오의 셋업에서도 비슷한 종류의 멋을 느꼈습니다.
로우 라이즈 스타일의 부활을 앞장서서 이끈 미우미우도 어김없이 로우 라이즈 스커트를 무대에 올렸습니다. 특히 수영복에 플리츠 스커트를 매치한 룩은 조합하는 재미까지 톡톡했죠. 하네스 벨트에 매달린 프라다의 스커트는 또 어떻고요. 베르사체의 룩은 섹시보다 페미닌하다는 표현이 더 잘 어울렸습니다. 단순한 구성, 생생한 컬러와 패턴으로 세련된 실루엣을 연출했죠.
로우 라이즈 스커트는 몸을 불편하게 조이지 않습니다. 보디라인을 있는 그대로 강조하죠. 한껏 내려 입은 실루엣은 어색할 순 있어도 인위적이진 않습니다. 로우 라이즈 팬츠에 비해 난도가 낮다는 점도 한몫합니다. 짧은 밑위길이에서 느껴지는 불편함이 없으니까요. 스커트의 유동성은 이 라인을 더욱 자연스럽고 매력적으로 보이게 할 테고요.
어렵게 생각할 필요 없습니다. 집에 있는 니트, 슬립 스커트를 평소보다 조금만 더 내려 입어보세요. 슬릿 스커트나 미니스커트와는 완전히 다른 관능미를 마주하게 될 겁니다. 때로는 오프숄더보다 한쪽 어깨가 흘러내린 오버사이즈 니트가 더 매력적인 것처럼요.",https://www.vogue.co.kr/2025/02/25/%eb%82%ae%ec%9d%84%ec%88%98%eb%a1%9d-%ec%b9%98%eb%aa%85%ec%a0%81%ec%9d%b8-%ec%98%ac%eb%b4%84-%ec%8a%a4%ec%bb%a4%ed%8a%b8-%ec%8a%a4%ed%83%80%ec%9d%bc%eb%a7%81/
W Korea,2025-03-12,"멋 내고 싶지만, 티 내고 싶지는 않을 때, '이 스커트' 입으세요","바쁜 아침, 스타일링을 쉽게 만들어주는 아이템? 대충 입어도 멋있는 회색 스커트 추천이요.
스커트 하나만으로 다양한 스타일을 연출할 수 있다면? 그 답은 회색 스커트에 있습니다. 블랙처럼 강렬하지 않으면서 적당한 무게감을 가지고 있고, 화이트처럼 부담스럽지 않으면서도 은근한 세련미가 느껴지는 컬러. 결국 힘을 빼고 싶을 때도, 조금은 공들인 듯 보이고 싶을 때도, 가장 안정적인 선택이 되는 아이템이라는 말이죠.
회색 스커트가 주는 은은한 멋은 컬러감에만 국한되지는 않습니다. 실루엣에 따라 분위기는 달라져요. A라인은 단정하면서 자연스럽게 여성스러움을 더해주고, 플리츠는 움직임이 만들어내는 우아함이 있죠. H라인은 날렵하고 도시적인 분위기를 자아내지만, 소재에 따라 한층 부드러워지기도 합니다. 중요한 것은 어떤 실루엣을 선택하든 회색이라는 색감이 과하거나 촌스럽지 않게 정제된 분위기를 완성한다는 점이에요.
회색 스커트를 제대로 활용하는 핵심은 스타일링에 있습니다. 이 중립적인 컬러는 다양한 조합을 시도하기에 더없이 좋은 베이스이니까요. 루즈한 니트를 스커트에 가볍게 넣어 입으면 힘을 뺀 듯한 시크한 룩이 완성되고요. 재킷을 더하면 단숨에 모던한 분위기가 살아나죠. 관건은 회색 스커트가 본래 가지고 있는 유연함을 해치지 않는 것. 블랙 스커트가 룩을 확실하게 정리해준다면, 회색 스커트는 흐름을 자연스럽게 만들어주거든요. 꾸안꾸 스타일을 완성하는 데 있어 더할 나위 없는 아이템임이 확실하네요.
회색 스커트의 분위기는 신발로도 확연히 달라집니다. 같은 룩이라도 슈즈의 디자인에 따라 전혀 다른 인상을 주죠. 톤온톤으로 맞춘 룩에 컬러감 있는 슈즈를 더하면 한층 트렌디한 느낌이, 클래식한 무드를 원한다면 로퍼나 메리제인과 매치하는 게 정답이에요. 날렵한 부츠를 신으면 조금 더 도회적인 느낌이 들고, 청키한 스니커즈를 더하면 예상치 못한 믹스매치의 재미를 얻을 수 있을 겁니다.
결국 회색 스커트의 가장 큰 힘은 어디에나 두루 스며든다는 점이에요. 덕분에 어떤 스타일을 시도하든 부담 없이 손이 가게 되는 아이템이기도 하죠. 올봄, 만약 단 하나의 스커트를 고른다면, 그것이 회색이어야 하는 이유는 충분하지 않을까요?",https://www.wkorea.com/2025/03/12/%eb%a9%8b-%eb%82%b4%ea%b3%a0-%ec%8b%b6%ec%a7%80%eb%a7%8c-%ed%8b%b0-%eb%82%b4%ea%b3%a0-%ec%8b%b6%ec%a7%80%eb%8a%94-%ec%95%8a%ec%9d%84-%eb%95%8c-%ec%9d%b4-%ec%8a%a4%ec%bb%a4%ed%8a%b8-%ec%9e%85/
W Korea,2025-03-12,베컴가 막내 아들 크루즈와 10살 연상 여친의 커플룩,"엄마 빅토리아의 새로운 컬렉션을 위해 베컴가 식구들이 총출동했습니다. 장성한 아들들과 여자친구들도 그 자리에 함께 했죠. 그 중에서도 삼남 중 막내인 크루즈 베컴의 힙한 패션과 그의 10살 연상 여자친구, 뮤지션 재키 아포스텔의 커플 룩이 예사롭지 않았어요. 봄이라 그런가요, 이들의 모습을 보기만해도 설렙니다.
영국에서 파리에 도착한 첫날, 커플은 두 손을 꼭 잡은 채 호텔에 도착했어요. 어두운 밤을 빛내는 건 이들이 각자 착용한 컬러풀한 아이템 덕분입니다. 재키 아포스텔은 블랙 레더 봄버 재킷에 일자 청바지를 입고 여기에 샛노란 장갑으로 포인트를 줬어요. 크루즈 베컴은 힙합 스타일의 배기 팬츠에 빈티지 티셔츠를 입고 새빨간 스웻셔츠를 어깨에 매 주었네요.
이들의 컬러 플레이는 계속됩니다. 비비드한 주황색의 니트 톱을 입은 크루즈는 블랙 배기 팬츠를 입고 클래식한 로퍼를 신었어요. 그 안에 신은 오렌지 양말이 슬쩍 시선을 사로잡네요. 재키는 색깔별로 장갑을 구비하고 있는 걸까요? 노란색에 이어 이번에 빨간 레더 장갑을 착용하고 레드 펌프스와 컬러 매칭을 선보였습니다. 빈티지 퍼 재킷에 까만 스타킹을 신어 관능미를 드러냈죠.
빅토리아 베컴의 2025 F/W 컬렉션에 참석하기 위해 크루즈와 재키는 각자 매력적이고 포멀한 슬립 드레스와 핀 스트라이프 수트를 선택했어요. 섹시한 오픈 백 디자인의 롱 슬립 드레스를 입고 블랙 슈즈와 클러치 백을 든 재키 아포스텔. 크루즈 베컴은 레트로 풍의 플레어 팬츠와 더블 브레스트 버튼의 재킷 수트의 올드 뮤지션 스타일로 여자친구를 에스코트했습니다.
앞서 재키는 파워풀한 매니시 룩으로 누나의 카리스마를 보여주기도 했는데요, 핀 스트라이프의 더블 브레스트 수트를 입고 화이트 셔츠와 블랙 타이까지 야무지개 착용한 모습이 인상적이었어요. 반면 크루즈는 화이트 티셔츠에 레더 재킷과 배기 팬츠를 입고 20살, 갓 청년이 된 풋풋함을 드러내기도 했죠.",https://www.wkorea.com/2025/03/12/20%ec%82%b4-%eb%a7%89%eb%82%b4-%ec%95%84%eb%93%a4-%ed%81%ac%eb%a3%a8%ec%a6%88-%eb%b2%a0%ec%bb%b4%ea%b3%bc-10%ec%82%b4-%ec%97%b0%ec%83%81-%ec%97%ac%ec%b9%9c%ec%9d%98-%ec%bb%a4%ed%94%8c%eb%a3%a9/
W Korea,2025-03-12,차세대 사복 천재의 등장! 베이비 몬스터 아사의 데일리 룩,"‘인간 핀터레스트’ 베이비 몬스터 아사가 옷 입는 법
차세대 사복 천재가 등장했습니다. 센스 넘치는 스타일링으로 주목받고 있는 베이비 몬스터 아사인데요. 매번 완벽한 룩을 선보이는 그녀. 사랑스러운 레이어드 룩부터 힙한 펑크 룩까지 소화하는 아사의 데일리 룩을 모았습니다.
Y2K 감성이 물씬 풍기는 아사의 OOTD. 올 블랙 룩에 스트라이프 숏츠와 뉴스보이 캡을 더해 빈티지한 무드를 완성했는데요. 청청 패션에는 하트 컷아웃 톱으로 위트를 더하고, 블랙 프레임 안경으로 마무리해 시크함까지 챙겼습니다.
래퍼가 이렇게 러블리해도 되는 건가요? 플리츠 스커트, 니트 드레스 등 미니멀한 아이템들로 소녀감성 룩을 완성했어요. 여기에 메리제인 구두와 레이스 삭스를 더하니 로맨틱한 무드가 배가됐죠.
심플한 티셔츠도 레이어드를 거치면 한층 감각적인 룩으로 변신할 수 있죠. 아사만의 스타일링 공식은 몸에 딱 맞는 톱을 레이어드해 슬림하고 여성스러운 실루엣을 강조하는 것. 플라워, 스트라이프 패턴 같은 아이템을 더하면 그 효과는 더욱 배가되죠.
화려한 펑크 & 그런지 룩도 완벽하게 소화하는 아사. 레더 재킷에 미니 스커트, 여기에 호피 패턴 톱과 아가일 체크 스타킹으로 힙한 분위기를 살렸습니다.
무채색 룩을 골랐다면, 단조로움을 깨울 한 끗 포인트가 필요하죠. 아사는 도트 무늬 백으로 경쾌한 리듬을 더했어요. 덕분에 모노톤 스타일도 밋밋하지 않고, 통통 튀어 보이는군요.
What’s New
2025.03.07by 서명희",https://www.wkorea.com/2025/03/12/%ec%b0%a8%ec%84%b8%eb%8c%80-%ec%82%ac%eb%b3%b5-%ec%b2%9c%ec%9e%ac%ec%9d%98-%eb%93%b1%ec%9e%a5-%eb%b2%a0%ec%9d%b4%eb%b9%84-%eb%aa%ac%ec%8a%a4%ed%84%b0-%ec%95%84%ec%82%ac%ec%9d%98-%eb%8d%b0%ec%9d%bc/
W Korea,2025-03-12,따라 사고 싶은 셀럽들의 여행 룩 필수 아우터,"여행지에서 입는 블랙 레더 재킷의 맛
이번 패션 위크에선 간절기의 선선한 기온을 즐길 수 있었습니다. 적당히 낮은 온도와 기분 좋은 바람이 부는 날씨엔 레더 재킷 만한 패션 아이템이 없죠. 셀럽들도 패션 위크, 콘서트 등 여러 이유로 방문한 해외에서 레더 재킷을 활용한 다양한 스타일링을 선보였어요.
카리나는 레더 소재로 온 몸을 무장했습니다. 그는 레더 재킷에 레더 재킷을 하나 더 겹쳐 입는 독특한 패션을 선보였죠. 이는 프라다의 25SS 컬렉션 스타일링이었는데요. 엘로우 슈즈로 포인트를 준 모델과 달리 카리나는 블랙 힐로 전체적인 색감을 통일했군요.
그는 레더 재킷을 활용한 룩으로 밀라노를 돌아다니며 다양한 사진을 남기기도 했습니다. 볼캡과 셔츠 등 가장 기본적인 아이템을 센스 있게 매치해 일상에서도 따라하기 좋은 스타일을 완성했죠.
꽃샘추위에 참고하기 좋은 스타일링입니다. 코가 시큰해지는 낮은 온도엔 로제처럼 레더 재킷 위에 코트를 걸칠 것! 블랙 레더 재킷, 카멜 코트의 소재와 컬러 대비가 인상적입니다. 여행지에서 근사한 디너가 예정되어 있을 때 참고하기 좋은 고급스러운 믹스 앤 매치 룩이죠.
키스오브라이프 하늘은 레더 재킷을 영하게 활용한 모습이에요. 심플한 레더 재킷에 매치한 니삭스와 베레모 등의 아이템이 룩에 프레피 무드를 더합니다.
이 자매의 옷장이 궁금해지는 순간이죠. 파리 패션위크를 누비고 있는 지지와 벨라는 이번 시즌, 유독 레더 재킷을 입은 파파라치 컷이 많이 포착되었습니다. 이들은 오버사이즈 재킷으로 벌키한 실루엣을 연출하고, 모노톤 컬러로 세련된 패션을 완성했죠. 올해는 ‘레더 온 레더’ 패션이 유행할 전망인가봅니다. 지지와 벨라는 공통적으로 레더 팬츠를 픽했어요. 은은한 광택이 우아하고 멋스럽죠.",https://www.wkorea.com/2025/03/12/%eb%94%b0%eb%9d%bc-%ec%82%ac%ea%b3%a0-%ec%8b%b6%ec%9d%80-%ec%85%80%eb%9f%bd%eb%93%a4%ec%9d%98-%ec%97%ac%ed%96%89-%eb%a3%a9-%ed%95%84%ec%88%98-%ec%95%84%ec%9a%b0%ed%84%b0/
W Korea,2025-03-12,"올봄, 패션만큼은 한껏 반항적이어도 괜찮습니다","‘찢청’이 돌아왔다고?
와이드 팬츠부터 스키니 진까지, 청바지 실루엣의 유행은 해마다 바뀌지만 그와는 다른 길을 걷는 청바지가 있습니다. 일명 ‘찢청’이라 불리는 디스트로이드 진은 찢기고 헤진 디테일로 남다른 존재감을 드러내죠. 이번 시즌 다시 활개를 편 디스트로이드 진을 제대로 즐기고 싶다면 멋 좀 아는 인플루언서들의 찢청 룩을 참고해 보세요.
무릎만 찢어진 디스트로이드 진은 은근한 반항미가 매력 포인트죠. 과하지 않은 컷아웃 덕분에 빈티지하면서도 시크한 무드를 연출할 수 있어요. 테일러드 재킷과 매치하면 쿨한 출근 룩이, 보헤미안 무드의 롱 카디건과 함께하면 감성적인 휴양지 룩이 완성됩니다.
남자친구 옷장에서 꺼낸 듯한 넉넉한 오버사이즈 실루엣의 디스트로이드 진. 스트릿 무드엔 이만한 게 없죠. 밝은 컬러나 패턴이 돋보이는 톱과 찰떡 궁합이에요. 슈즈는 아웃도어 무드의 워크 부츠로 마무리하면 보이시한 매력도 제대로 살릴 수 있답니다.
어디에, 얼마나 찢어졌는가에 따라 디스트로이드 진의 분위기도 천차만별. 극단적인 헤짐이 강조된 디자인은 강렬한 존재감을 발산합니다. 루즈한 화이트 티셔츠로 힘을 빼고, 볼드한 액세서리로 엣지를 살렸어요.
반전 매력을 극대화하고 싶다면 상반된 스타일을 조합해보는 것도 방법입니다. 메탈 아일렛 디테일이 더해진 디스트로이드 진에 스포티한 스트라이프 폴로 셔츠를 매치해 색다른 텐션을 연출했어요. 예상 밖의 조합이지만 그래서 더 쿨하게 느껴지죠. 거친 듯하지만 세련된 록 시크 무드에 은근한 카리스마까지 더해졌어요.",https://www.wkorea.com/2025/03/12/%ec%b0%a2%ec%b2%ad%ec%9d%b4-%eb%8f%8c%ec%95%84%ec%99%94%eb%8b%a4%ea%b3%a0/
